id,razao_social,nome_fantasia,responsavel_id,sector_id,status,observacoes,created_at,cnpj,situacao,data_situacao,inicio_atividades,natureza_juridica,porte,capital_social,simples_nacional,mei,cnae_principal,cnaes_secundarios,logradouro,numero,complemento,bairro,municipio,uf,cep,telefone1,telefone2,email,socios,company_number
"600a3e60-dcda-40c8-977f-49b3d8b1a8b8","OTMA - ENERGIA ELETRICA LTDA","DARIO ALBERTO PIRES CASTRO","","","ativo","","2026-05-26T20:00:28.415769+00:00","40.839.304/0001-61","ATIVA","2021-02-11","2021-02-11","Sociedade Empresária Limitada","EMPRESA DE PEQUENO PORTE","10000","Sim","Não","7112000 - Serviços de engenharia","4321500 - Instalação e manutenção elétrica | 4669999 - Comércio atacadista de outras máquinas e equipamentos não especificados anteriormente; partes e peças | 4742300 - Comércio varejista de material elétrico | 4757100 - Comércio varejista especializado de peças e acessórios para aparelhos eletroeletrônicos para uso doméstico, exceto informática e comunicação | 7319002 - Promoção de vendas","OMILIO MONTEIRO SOARES","","","FANNY","CURITIBA","PR","81030-001","(41) 96869828","","","DARIO ALBERTO PIRES CASTRO (Sócio-Administrador)",""
"3842e5e8-0c81-4d85-a67a-cfecd5bb5baa","PAGANELLI & PIMENTA LTDA","","","","ativo","","2026-05-26T20:08:19.108819+00:00","04.607.185/0001-58","ATIVA","2005-11-03","2001-08-14","Sociedade Empresária Limitada","EMPRESA DE PEQUENO PORTE","50000","Sim","Não","4761003 - Comércio varejista de artigos de papelaria","4721104 - Comércio varejista de doces, balas, bombons e semelhantes | 4723700 - Comércio varejista de bebidas | 4753900 - Comércio varejista especializado de eletrodomésticos e equipamentos de áudio e vídeo | 4754701 - Comércio varejista de móveis | 4759899 - Comércio varejista de outros artigos de uso pessoal e doméstico não especificados anteriormente | 4763601 - Comércio varejista de brinquedos e artigos recreativos | 4772500 - Comércio varejista de cosméticos, produtos de perfumaria e de higiene pessoal | 4781400 - Comércio varejista de artigos do vestuário e acessórios | 4782201 - Comércio varejista de calçados | 4782202 - Comércio varejista de artigos de viagem | 4789001 - Comércio varejista de suvenires, bijuterias e artesanatos | 4789099 - Comércio varejista de outros produtos não especificados anteriormente","ARISTIDES DE OLIVEIRA","","LOJA 03","JD ATUBA I","PINHAIS","PR","83326-160","(41) 6672056","","","JOSE REINALDO PIMENTA (Sócio-Administrador) | SIRLEI DE SOUZA PAGANELLI PIMENTA (Sócio-Administrador)",""
"ed778251-15a0-48b0-a1f4-8838f02d6624","PAMASI NEGOCIOS LTDA","PAMASI NEGOCIOS","","","ativo","","2026-05-26T20:08:19.108819+00:00","62.523.008/0001-90","ATIVA","2025-09-02","2025-09-02","Sociedade Empresária Limitada","MICRO EMPRESA","5000","Sim","Não","7490104 - Atividades de intermediação e agenciamento de serviços e negócios em geral, exceto imobiliários","6619399 - Outras atividades auxiliares dos serviços financeiros não especificadas anteriormente | 7319002 - Promoção de vendas","GETULIO VARGAS","","","JARDIM AMELIA","PINHAIS","PR","83330-180","(41) 36698658","(00) 0000000000","","PAULO MARCOS DA SILVA (Sócio-Administrador)",""
"f5015b55-9229-4256-9788-f3d39e33d2ca","PANSINI ENGENHARIA LTDA","","","","ativo","","2026-05-26T20:08:19.108819+00:00","13.656.102/0001-01","ATIVA","2011-05-09","2011-05-09","Sociedade Empresária Limitada","DEMAIS","400000","","","4110700 - Incorporação de empreendimentos imobiliários","4120400 - Construção de edifícios | 6462000 - Holdings de instituições não-financeiras | 6810201 - Compra e venda de imóveis próprios | 6810202 - Aluguel de imóveis próprios | 6822600 - Gestão e administração da propriedade imobiliária | 7112000 - Serviços de engenharia","RODOLPHO SENFF","","","JARDIM DAS AMERICAS","CURITIBA","PR","81530-240","(41) 96846971","","","GUSTAVO ALVES PANSINI (Sócio-Administrador)",""
"5264f0bd-484c-4973-80de-771028c6e8db","PARADA PINHAIS LTDA","","","","ativo","","2026-05-26T20:08:19.108819+00:00","47.008.571/0001-36","ATIVA","2022-07-04","2022-07-04","Sociedade Empresária Limitada","MICRO EMPRESA","10000","Sim","Não","5611201 - Restaurantes e similares","4712100 - Comércio varejista de mercadorias em geral, com predominância de produtos alimentícios - minimercados, mercearias e armazéns | 4723700 - Comércio varejista de bebidas | 5611203 - Lanchonetes, casas de chá, de sucos e similares | 5620104 - Fornecimento de alimentos preparados preponderantemente para consumo domiciliar","JOAO LEOPOLDO JACOMEL - RODOVIA DAS AGUAS","","LOJA LOJA 05","CENTRO","PINHAIS","PR","83323-410","(41) 96847117","","","AMANDA MENDES (Sócio-Administrador)",""
"11eefc9b-b20b-4d29-8b5f-136a082a50f1","PARK BARIGUI COMERCIO DE CALCADOS E ACESSORIOS LTDA","LUIZA BARCELOS","","","ativo","","2026-05-26T20:08:19.108819+00:00","39.397.357/0001-90","ATIVA","2020-10-13","2020-10-13","Sociedade Empresária Limitada","EMPRESA DE PEQUENO PORTE","349000","Sim","Não","4782201 - Comércio varejista de calçados","4781400 - Comércio varejista de artigos do vestuário e acessórios | 4782202 - Comércio varejista de artigos de viagem","PROFESSOR PEDRO VIRIATO PARIGOT DE SOUZA","","","MOSSUNGUE","CURITIBA","PR","81200-100","(41) 99487800","(41) 36697399","","AMANDA LORENA CARNEIRO SCARATTI (Sócio-Administrador)",""
"a7a6dd67-4c17-4029-8eb2-9268d22b57ff","PASSARELLA CALCADOS LTDA","PASSARELLA CALCADOS","","","ativo","","2026-05-26T20:08:19.108819+00:00","48.174.263/0001-43","ATIVA","2022-10-04","2022-10-04","Sociedade Empresária Limitada","MICRO EMPRESA","30000","Sim","Não","4782201 - Comércio varejista de calçados","4763602 - Comércio varejista de artigos esportivos | 4781400 - Comércio varejista de artigos do vestuário e acessórios | 4782202 - Comércio varejista de artigos de viagem","EUROPA","","APT SHOPPING METROPOLITA","CENTRO","PINHAIS","PR","83323-300","(41) 97029944","(00) 0000000000","","ANA LUIZA MAESTRELLI HELBE (Sócio-Administrador) | RAFAEL HENRIQUE HELBE (Sócio-Administrador)",""
"d8d3064b-cd48-42fd-b707-77c4d41166e7","PASSARELLA CALCADOS SJP LTDA","PASSARELLA CALCADOS","","","ativo","","2026-05-26T20:08:19.108819+00:00","58.110.931/0001-22","ATIVA","2024-11-14","2024-11-14","Sociedade Empresária Limitada","MICRO EMPRESA","50000","Sim","Não","4782201 - Comércio varejista de calçados","","ANNELIESE GELLERT KRIGSNER","","LOJA 07","INÁ","SAO JOSE DOS PINHAIS","PR","83065-470","(41) 97815386","(00) 0000000000","","ANA LUIZA MAESTRELLI HELBE (Sócio-Administrador)",""
"f6e6f752-a8eb-403a-8d88-ee6cdd0df45e","PAULO ROBERTO HUBNER & CIA LTDA","PANIFICADORA JULIANA","","","ativo","","2026-05-26T20:08:19.108819+00:00","10.262.083/0001-40","ATIVA","2008-08-01","2008-08-01","Sociedade Empresária Limitada","MICRO EMPRESA","10000","Sim","Não","1091102 - Fabricação de produtos de padaria e confeitaria com predominância de produção própria","1096100 - Fabricação de alimentos e pratos prontos","RIO PARANAPANEMA","","","WEISSOPOLIS","PINHAIS","PR","83322-180","(41) 36535148","","","JULIANA APARECIDA MARIANO HUBNER (Sócio-Administrador) | PAULO ROBERTO HUBNER (Sócio-Administrador)",""
"f7aee879-0bbe-4089-866d-4b5e44696307","PELES YARA COMERCIO E CONFECCAO DE ARTIGOS DE LAS E COUROS LTDA","","","","ativo","","2026-05-26T20:08:19.108819+00:00","02.664.292/0001-92","ATIVA","2004-04-09","1998-07-16","Sociedade Empresária Limitada","MICRO EMPRESA","15000","Sim","Não","1529700 - Fabricação de artefatos de couro não especificados anteriormente","4782202 - Comércio varejista de artigos de viagem | 4781400 - Comércio varejista de artigos do vestuário e acessórios","JOAO BAPTISTA SETIM","","","RIO DE UNA","TIJUCAS DO SUL","PR","83197-830","(41) 32676787","","","LAENIO DA SILVA (Sócio-Administrador) | TANIA MARA DE OLIVEIRA (Sócio)",""
"9da4c208-3f14-4185-9e7c-7818cbf714d8","PERFIX INDUSTRIA DE CONFECCOES LTDA","PERFIX ROUPAS PROFISSIONAIS","","","ativo","","2026-05-26T20:08:19.108819+00:00","57.508.090/0001-43","ATIVA","2024-10-01","2024-10-01","Sociedade Empresária Limitada","MICRO EMPRESA","40000","Sim","Não","1413401 - Confecção de roupas profissionais, exceto sob medida","1412601 - Confecção de peças de vestuário, exceto roupas íntimas e as confeccionadas sob medida | 4642702 - Comércio atacadista de roupas e acessórios para uso profissional e de segurança do trabalho","HERBERT TRAP","","","GUARITUBA","PIRAQUARA","PR","83311-170","(41) 34031413","","","CLAIR ELVIRA MARCAL DOS SANTOS (Sócio-Administrador) | MARCIO AURELIO LISBOA (Sócio)",""
"920211d0-c6e8-4dc2-ad5e-97edaf12c10d","PERSONALIZEP - SERVICOS ADMINISTRATIVOS LTDA","PERSONALIZEP","","","ativo","","2026-05-26T20:00:46.000534+00:00","06.953.107/0001-30","ATIVA","","2004-08-23","Sociedade Empresária Limitada","MICRO EMPRESA","20000","Sim","Não","8219999 - Preparação de documentos e serviços especializados de apoio administrativo não especificados anteriormente","7319002 - Promoção de vendas","ROLANDIA","","CASA 63","COND RES PINEFIELDS","PINHAIS","PR","83325-310","(41) 91129476","","","MARIA REGINA BAUNGART ZANIN (Sócio-Administrador)",""
"777e43c2-56db-4408-b497-0c36e6cd73c8","PIZZA PARA VOCE DOM PEDRO II LTDA","PIZZA PARA VOCE DOM PEDRO II","","","ativo","","2026-05-26T20:08:19.108819+00:00","51.758.938/0001-06","ATIVA","2023-08-10","2023-08-10","Sociedade Empresária Limitada","EMPRESA DE PEQUENO PORTE","20000","Sim","Não","5620104 - Fornecimento de alimentos preparados preponderantemente para consumo domiciliar","","BENTO RIBEIRO","","","NOVA RUSSIA","PONTA GROSSA","PR","84053-360","(42) 84420999","","","ANTONIO ZANETTE LOPES (Sócio-Administrador)",""
"d357c02d-da58-4082-9f6f-f32b77236bf7","PIZZARIA CASTRO LTDA","PIZZA PARA VOCE CASTRO","","","ativo","","2026-05-26T20:08:19.108819+00:00","54.172.122/0001-94","ATIVA","2024-03-04","2024-03-04","Sociedade Empresária Limitada","MICRO EMPRESA","20000","Sim","Não","5611201 - Restaurantes e similares","5611203 - Lanchonetes, casas de chá, de sucos e similares | 5620104 - Fornecimento de alimentos preparados preponderantemente para consumo domiciliar","QUINZE DE NOVEMBRO","","","CENTRO","CASTRO","PR","84165-680","(41) 97771744","(00) 0000000000","","ANTONIO ZANETTE LOPES (Sócio-Administrador) | LUCIANI DE CACIA LOPES (Sócio)",""
"3a3152aa-31eb-4780-90d6-41f3d89b8bde","PIZZARIA DO FUTURO BAIRRO ALTO LTDA","PIZZA PRA VOCE","","","ativo","","2026-05-26T20:08:19.108819+00:00","37.894.061/0001-50","ATIVA","2020-07-29","2020-07-29","Sociedade Empresária Limitada","MICRO EMPRESA","10000","Sim","Não","5620104 - Fornecimento de alimentos preparados preponderantemente para consumo domiciliar","","JOSE DE OLIVEIRA FRANCO","","","BAIRRO ALTO","CURITIBA","PR","82820-110","(41) 96609422","","","JERRY CRISTIAN LOPES CARDOSO (Sócio-Administrador)",""
"ccac4f8f-9d1b-4332-aa7d-434f3a39425c","PIZZARIA DO FUTURO CAJURU LTDA","PIZZA DO FUTURO CAJURU","","","ativo","","2026-05-26T20:08:19.108819+00:00","36.948.442/0001-01","ATIVA","2020-04-16","2020-04-16","Sociedade Empresária Limitada","MICRO EMPRESA","10000","Sim","Não","5620104 - Fornecimento de alimentos preparados preponderantemente para consumo domiciliar","","SEBASTIAO MARCOS LUIZ","","","CAJURU","CURITIBA","PR","82930-060","(41) 96609422","","","JERRY CRISTIAN LOPES CARDOSO (Sócio-Administrador)",""
"0f89c6d9-0235-4bd8-9d0a-e797aa2fe01b","PIZZARIA DO FUTURO CAPAO DA IMBUIA LTDA","PIZZA PRA VOCE CAPAO DA IMBUIA","","","ativo","","2026-05-26T20:08:19.108819+00:00","40.832.684/0001-02","ATIVA","2021-02-12","2021-02-12","Sociedade Empresária Limitada","MICRO EMPRESA","10000","Sim","Não","5620104 - Fornecimento de alimentos preparados preponderantemente para consumo domiciliar","","PAULO KISSULA","","LOJA 01 COND KISSULA CD","CAPAO DA IMBUIA","CURITIBA","PR","82810-530","(41) 97360074","","","JERRY CRISTIAN LOPES CARDOSO (Sócio-Administrador)",""
"56a11cee-ecfe-4c23-9862-f761795c8392","PIZZARIA DO FUTURO PINHAIS LTDA","PIZZA DO FUTURO PINHAIS","","","ativo","","2026-05-26T20:08:19.108819+00:00","47.446.546/0001-34","ATIVA","2022-08-05","2022-08-05","Sociedade Empresária Limitada","MICRO EMPRESA","10000","Sim","Não","5620104 - Fornecimento de alimentos preparados preponderantemente para consumo domiciliar","","JOAO LEOPOLDO JACOMEL","","LOJA LOJA 02","CENTRO","PINHAIS","PR","83323-410","(41) 96609422","(00) 0000000000","","CARLOS GABRIEL PEREZ DE LIMA (Sócio-Administrador)",""
"0829dc6d-af00-4429-ba8f-29f3bf79b8b6","PIZZARIA DO FUTURO UBERABA LTDA","PIZZARIA DO FUTURO UBERABA","","","ativo","","2026-05-26T20:08:19.108819+00:00","43.893.389/0001-54","ATIVA","2021-10-15","2021-10-15","Sociedade Empresária Limitada","MICRO EMPRESA","10000","Sim","Não","5620104 - Fornecimento de alimentos preparados preponderantemente para consumo domiciliar","","SENADOR SALGADO FILHO","","LOJA 02 ANDAR TR COND VILLA ATACAMA E CJ CBLOCO VILLA ATACAMA E CJ E","GUABIROTUBA","CURITIBA","PR","81510-001","(41) 96609422","","","JERRY CRISTIAN LOPES CARDOSO (Sócio-Administrador)",""
"f0aea566-021c-44e0-aeda-1c0e977c04af","PIZZARIA DONA DILAJU 2 LTDA","","","","ativo","","2026-05-26T20:08:19.108819+00:00","59.248.029/0001-30","ATIVA","2025-02-03","2025-02-03","Sociedade Empresária Limitada","MICRO EMPRESA","20000","Sim","Não","5620104 - Fornecimento de alimentos preparados preponderantemente para consumo domiciliar","4723700 - Comércio varejista de bebidas","CARLOS GOMES","","","PARQUE SÃO PAULO","CASCAVEL","PR","85803-000","(41) 95501119","(00) 0000000000","","EODILA DA SILVA TESTA (Sócio-Administrador)",""
"536d6a62-0843-44d3-b6d5-354d15c66bb6","PIZZARIA DONA LAURA LTDA","","","","ativo","","2026-05-26T20:08:19.108819+00:00","61.389.039/0001-37","ATIVA","2025-06-20","2025-06-20","Sociedade Empresária Limitada","MICRO EMPRESA","20000","Sim","Não","5620104 - Fornecimento de alimentos preparados preponderantemente para consumo domiciliar","4723700 - Comércio varejista de bebidas","PAPAGAIOS","","","FLORESTA","CASCAVEL","PR","85814-760","(45) 30390039","(00) 0000000000","","ANDRE CARLOS TESTA (Sócio-Administrador) | EODILA DA SILVA TESTA (Sócio-Administrador)",""
"27ada993-8f97-4573-a757-5e2e1bfbc9dd","PIZZARIA FEDRIGO LTDA","PANIFICADORA TOP PAO","","","ativo","","2026-05-26T20:08:19.108819+00:00","24.226.265/0001-70","ATIVA","2016-02-23","2016-02-23","Sociedade Empresária Limitada","MICRO EMPRESA","96000","Não","Não","5611201 - Restaurantes e similares","5611203 - Lanchonetes, casas de chá, de sucos e similares | 5620104 - Fornecimento de alimentos preparados preponderantemente para consumo domiciliar","JOAO LEOPOLDO JACOMEL","","LOJA 05","CENTRO","PINHAIS","PR","83323-410","(41) 30564150","","","CLOVIS URBANO FEDRIGO (Sócio-Administrador)",""
"2478c0c5-ce8c-4efd-a015-7c50adaf6273","PIZZARIA IRATI LTDA","","","","ativo","","2026-05-26T20:08:19.108819+00:00","58.472.295/0001-89","ATIVA","2024-12-16","2024-12-16","Sociedade Empresária Limitada","MICRO EMPRESA","20000","Sim","Não","5620104 - Fornecimento de alimentos preparados preponderantemente para consumo domiciliar","","DA LIBERDADE","","","CENTRO","IRATI","PR","84500-049","(42) 34221302","","","ALINE BEATRIZ LAMEIRO VARGAS (Sócio-Administrador)",""
"15899854-68fe-4e7a-9736-ce799d2881c8","PIZZARIA PRECO BAIXO GUARITUBA LTDA","PIZZARIA PRECO BAIXO GUARITUBA","","","ativo","","2026-05-26T20:08:19.108819+00:00","64.855.713/0001-10","ATIVA","2026-02-02","2026-02-02","Sociedade Empresária Limitada","MICRO EMPRESA","20000","Sim","Não","5620104 - Fornecimento de alimentos preparados preponderantemente para consumo domiciliar","4723700 - Comércio varejista de bebidas","HERBERT TRAP","","","GUARITUBA","PIRAQUARA","PR","83310-390","(41) 98201804","(00) 0000000000","","LUAN BRAYAN PINTO DE ANDRADE (Sócio-Administrador)",""
"b6dbfaa9-2867-46f9-a658-c7e22e61bffe","PIZZARIA PRECO BAIXO LTDA","","","","ativo","","2026-05-26T20:08:19.108819+00:00","60.250.395/0001-02","ATIVA","2025-04-04","2025-04-04","Sociedade Empresária Limitada","MICRO EMPRESA","10000","Sim","Não","5620104 - Fornecimento de alimentos preparados preponderantemente para consumo domiciliar","","ESTANISLAU MAZEPA","","","VILA JULIANA","PIRAQUARA","PR","83306-060","(41) 98559337","(00) 0000000000","","CAMILA EDUARDA DO COUTO (Sócio-Administrador)",""
"94b3c984-da79-43f9-9d68-6693584fd1f6","PIZZARIA SAO GABRIEL LTDA","","","","ativo","","2026-05-26T20:08:19.108819+00:00","42.952.548/0001-81","ATIVA","2021-08-02","2021-08-02","Sociedade Empresária Limitada","MICRO EMPRESA","10000","Sim","Não","5620104 - Fornecimento de alimentos preparados preponderantemente para consumo domiciliar","","SAO GABRIEL","","LOJA 01","SAO GABRIEL","COLOMBO","PR","83404-642","(41) 91643641","","","PAULINO MORATO DE ANDRADE (Sócio-Administrador)",""
"95e96127-cd40-4114-8075-c8a41241f122","PKS TRANSPORTES LTDA","PKS TRANSPORTES EIRELI","","","ativo","","2026-05-26T20:08:19.108819+00:00","31.845.444/0001-51","ATIVA","2018-10-24","2018-10-24","Sociedade Empresária Limitada","EMPRESA DE PEQUENO PORTE","20000","Não","Não","4930201 - Transporte rodoviário de carga, exceto produtos perigosos e mudanças, municipal.","4520001 - Serviços de manutenção e reparação mecânica de veículos automotores | 4530701 - Comércio por atacado de peças e acessórios novos para veículos automotores | 4930202 - Transporte rodoviário de carga, exceto produtos perigosos e mudanças, intermunicipal, interestadual e internacional | 4930203 - Transporte rodoviário de produtos perigosos | 7020400 - Atividades de consultoria em gestão empresarial, exceto consultoria técnica específica","FOZ DO IGUACU","","","EMILIANO PERNETA","PINHAIS","PR","83324-500","(41) 98867130","","","KELLY REGINA ENDLICH NOGATZ (Sócio-Administrador)",""
"0a2a454d-c39a-4313-a3e9-ba3e8652c20d","POCATELLO BZ SERVICOS LTDA","","","","ativo","","2026-05-26T20:08:19.108819+00:00","58.190.185/0001-24","ATIVA","2024-11-22","2024-11-22","Sociedade Empresária Limitada","MICRO EMPRESA","10000","Sim","Não","8211300 - Serviços combinados de escritório e apoio administrativo","8299799 - Outras atividades de serviços prestados principalmente às empresas não especificadas anteriormente","TUCUM","","CASA 01 COND CAPRI V RES","UBERABA","CURITIBA","PR","81550-160","(41) 87150175","(00) 0000000000","","BRUNO PETENA ZIOLI (Sócio-Administrador)",""
"23720fa5-a358-4b66-ba2d-6e96bb926d3f","POLIMEROS JR PLASTICOS DE ENGENHARIA E COMPOSTOS TERMOPLASTICOS LTDA.","","","","ativo","","2026-05-26T20:08:19.108819+00:00","08.636.401/0001-44","ATIVA","2007-01-30","2007-01-30","Sociedade Empresária Limitada","MICRO EMPRESA","30000","Não","Não","4687702 - Comércio atacadista de resíduos e sucatas não-metálicos, exceto de papel e papelão","4930202 - Transporte rodoviário de carga, exceto produtos perigosos e mudanças, intermunicipal, interestadual e internacional | 6311900 - Tratamento de dados, provedores de serviços de aplicação e serviços de hospedagem na internet","ENG. SILVIO TEIXEIRA PINTO","","","CONJ. RES. ATUBA","PINHAIS","PR","83326-210","(41) 36658497","","","ABRAAO SOUSA RODRIGUES (Sócio-Administrador) | RITA DE CASSIA RODRIGUES (Sócio)",""
"c7baa651-c84b-40ec-8e6e-8cce34d9af49","PPR AGRO CONSULTORIA LTDA","","","","ativo","","2026-05-26T20:08:19.108819+00:00","42.488.983/0001-05","ATIVA","2021-06-28","2021-06-28","Sociedade Empresária Limitada","MICRO EMPRESA","5000","Sim","Não","7490103 - Serviços de agronomia e de consultoria às atividades agrícolas e pecuárias","","EDUARDO SPRADA","","CASA 01","CAMPO COMPRIDO","CURITIBA","PR","81210-370","(41) 92077270","","","PEDRO PAULO ROSSI (Sócio-Administrador)",""
"6b35492c-9d38-438a-880a-c2218eefa00b","PREDILUB LTDA.","PREDILUB","","","ativo","","2026-05-26T20:08:19.108819+00:00","09.009.974/0001-00","ATIVA","2022-06-14","2007-05-25","Sociedade Empresária Limitada","MICRO EMPRESA","25000","Sim","Não","4744001 - Comércio varejista de ferragens e ferramentas","3314799 - Manutenção e reparação de outras máquinas e equipamentos para usos industriais não especificados anteriormente","PROFESSOR OLIMPIO DE ALMEIDA","",": SOBRADO 10;","BACACHERI","CURITIBA","PR","82515-210","(41) 88133251","","","MIGUEL WILSON WASSEM (Sócio-Administrador)",""
"a5f35a81-3afb-4f42-9edd-861df00b6a73","PRIME SOLUCOES QUIMICAS LTDA","PRIME LUBE","","","ativo","","2026-05-26T20:08:19.108819+00:00","42.094.352/0001-01","ATIVA","2021-05-26","2021-05-26","Sociedade Empresária Limitada","EMPRESA DE PEQUENO PORTE","30000","Sim","Não","2093200 - Fabricação de aditivos de uso industrial","","HAITI","","APT UNID. 01","CENTRO","PINHAIS","PR","83320-160","(41) 35575426","(41) 92492779","","ANDRE LUIZ QUIRINO DO NASCIMENTO (Sócio-Administrador) | THIAGO QUIRINO DO NASCIMENTO (Sócio-Administrador)",""
"a2de8bad-67d7-488d-a169-f2bbd02acdd1","PRIMER CONSTRUCOES CIVIS LTDA","PRIMER CONSTRUCOES","","","ativo","","2026-05-26T20:08:19.108819+00:00","01.309.425/0001-40","ATIVA","2005-11-03","1996-04-10","Sociedade Empresária Limitada","MICRO EMPRESA","20000","Sim","Não","4120400 - Construção de edifícios","4399101 - Administração de obras | 4330499 - Outras obras de acabamento da construção","PADRE GIACOMO CUSMANO","","LOJA 12","CAMPINA DO SIQUEIRA","CURITIBA","PR","80730-230","(41) 30148745","","","ALEXANDRE ANDRE ROSSI (Sócio-Administrador) | RUBENS MALUF DABUL JUNIOR (Sócio-Administrador)",""
"cf212d78-0ba5-4001-919d-1e9c292b7c5e","Q&G - REPRESENTACOES COMERCIAIS LTDA","","","","ativo","","2026-05-26T20:08:14.497601+00:00","05.789.534/0001-62","ATIVA","","2003-07-28","Sociedade Empresária Limitada","EMPRESA DE PEQUENO PORTE","20000","","","4619200 - Representantes comerciais e agentes do comércio de mercadorias em geral não especializado","","ROLANDIA","","APT RESIDENCIA 02","ALTO TARUMA","PINHAIS","PR","83325-323","(41) 91212680","","","ADAILDO CESAR DE GODOY (Sócio-Administrador) | ELISANGELA REGINA BUFALO (Sócio)",""
"bc2bf1e2-2f8f-41f9-8b2b-ae0bdc8cd910","QUALIPLAS INDUSTRIA E COMERCIO DE PLASTICOS LTDA","QUALIPLAS INDUSTRIA E COMERCIO DE PLASTICO","","","ativo","","2026-05-26T20:08:14.497601+00:00","13.998.758/0001-02","ATIVA","2011-07-15","2011-07-15","Sociedade Empresária Limitada","EMPRESA DE PEQUENO PORTE","10000","Sim","Não","2222600 - Fabricação de embalagens de material plástico","","RIO PIQUIRI","","","WEISSOPOLIS","PINHAIS","PR","83322-010","(41) 30156644","(41) 84290587","","ADRIEL VICTOR DE SOUZA SANTOS (Sócio-Administrador) | ANDRE WILLIAN DE SOUZA SANTOS (Sócio-Administrador) | JOEL MAGNO DE SOUZA SANTOS (Sócio) | VALDIR RIBEIRO SANTOS (Sócio)",""
"42158c42-66f7-43a2-bc16-083ee94e0bc1","QUALITY AMBIENTES PLANEJADOS LTDA","QUALITY AMBIENTES PLANEJADOS","","","ativo","","2026-05-26T20:08:14.497601+00:00","52.405.782/0001-42","ATIVA","2023-10-03","2023-10-03","Sociedade Empresária Limitada","MICRO EMPRESA","30000","Sim","Não","3101200 - Fabricação de móveis com predominância de madeira","3329501 - Serviços de montagem de móveis de qualquer material","ANTONIO GONCALVES DIAS","","","VARGEM GRANDE","PINHAIS","PR","83321-070","(41) 99142293","","","SYLVESTER DIAS SIQUEIRA (Sócio-Administrador)",""
"35d24d2a-a6b1-43c7-8de1-f0f38742b844","R - LINE MULTIMARCAS LTDA","","","","ativo","","2026-05-26T20:08:14.497601+00:00","41.578.117/0001-34","ATIVA","2021-04-14","2021-04-14","Sociedade Empresária Limitada","MICRO EMPRESA","20000","Não","Não","4511102 - Comércio a varejo de automóveis, camionetas e utilitários usados","4512902 - Comércio sob consignação de veículos automotores | 4541204 - Comércio a varejo de motocicletas e motonetas usadas | 4542102 - Comércio sob consignação de motocicletas e motonetas | 7490104 - Atividades de intermediação e agenciamento de serviços e negócios em geral, exceto imobiliários","EUROPA","","","CENTRO","PINHAIS","PR","83323-300","(41) 36698002","(41) 91214421","","ITALO DANTON RAMALHO DA SILVA (Sócio-Administrador)",""
"28decc3c-b86c-4449-93a4-8b8122a76f7f","RAFAEL HENRIQUE HELBE - CONFECCOES","PASSARELA MODAS","","","ativo","","2026-05-26T20:08:14.497601+00:00","16.553.977/0001-76","ATIVA","2012-06-21","2012-06-21","Empresário (Individual)","MICRO EMPRESA","20000","Sim","Não","4781400 - Comércio varejista de artigos do vestuário e acessórios","4755502 - Comercio varejista de artigos de armarinho | 4755503 - Comercio varejista de artigos de cama, mesa e banho | 4761003 - Comércio varejista de artigos de papelaria | 4763601 - Comércio varejista de brinquedos e artigos recreativos | 4782201 - Comércio varejista de calçados | 4930202 - Transporte rodoviário de carga, exceto produtos perigosos e mudanças, intermunicipal, interestadual e internacional","","","","CENTRO","PINHAIS","PR","83323-300","","","","",""
"811142db-0f79-4b11-bbd8-5816e1c37cb1","RAMOS HOLDING LTDA","","","","ativo","","2026-05-26T20:08:14.497601+00:00","46.688.215/0001-48","ATIVA","2022-06-03","2022-06-03","Sociedade Empresária Limitada","DEMAIS","486000","","","6462000 - Holdings de instituições não-financeiras","6810201 - Compra e venda de imóveis próprios | 6810202 - Aluguel de imóveis próprios","MARIA LUIZA BORBA","","","ESTANCIA PINHAIS","PINHAIS","PR","83323-160","(41) 30598200","(00) 0000000000","","AIRES TADEU SILVA RAMOS (Sócio-Administrador) | JULIANO MARCELO RAMOS (Sócio) | SANDRO MARCELO RAMOS (Sócio)",""
"0eb99388-83c8-4b23-9652-c7892b089439","RENATA BUACHAK SERVICOS ADMINISTRATIVOS LTDA","","","","ativo","","2026-05-26T20:00:24.389738+00:00","48.466.283/0001-98","ATIVA","2022-10-31","2022-10-31","Sociedade Empresária Limitada","MICRO EMPRESA","5000","Sim","Não","8211300 - Serviços combinados de escritório e apoio administrativo","","JACOB MACANHAN","","","JARDIM CLAUDIA","PINHAIS","PR","83326-000","(41) 97997051","(00) 0000000000","","RENATA LIMA BUACHAK E RODRIGUES (Sócio-Administrador)",""
